{
  "object": "organization_invitation",
  "id": "example",
  "email_address": "jane@example.com",
  "role": "admin",
  "role_name": "Admin",
  "organization_id": "org_2abc4xyz567Q9zZdEf",
  "inviter_id": "invi_2abc4xyz567Q9zZdEf",
  "public_inviter_data": {
    "user_id": "user_2abc4xyz567Q9zZdEf",
    "first_name": "Jane",
    "last_name": "Doe",
    "image_url": "example",
    "has_image": false,
    "identifier": "example"
  },
  "status": "active",
  "public_metadata": {},
  "private_metadata": {},
  "url": "example",
  "expires_at": 1747939800,
  "created_at": 0,
  "updated_at": 0
}